headline,description,timestamp,article_link,article_content,writer,date_published
"Until NFL investigation ends, Justin Tucker could have a difficult time finding a new team",The Ravens have released kicker Justin Tucker. NBC SPORTS,N/A,https://www.nbcsports.com/nfl/profootballtalk/rumor-mill/news/until-nfl-investigation-ends-justin-tucker-could-have-a-difficult-time-finding-a-new-team?cid=nbcnews,"The Ravens have released kicker Justin Tucker. Once the transaction becomes official (presumably today), Tucker will become a free agent. In theory, he’ll be able to sign immediately with any team. As a practical matter, any interested team will likely wait. The NFL’s investigation regarding the allegations made against Tucker (he denies them all) will continue. He could eventually be suspended. It’s sensible to assume that teams will wait for the decision to be made — and the suspension, if any, to be served — before offering him a roster spot. Beyond the potential P.R. impact of bringing a kicker who doesn’t kick as well as he once did to town, Tucker’s next team won’t know when it will be able to use him until the suspension, if any, is served. If that’s how it plays out, it becomes important for Tucker to get this behind him as soon as he can. If it lingers into the 2025 season, he’ll be essentially suspended. That could make a negotiated outcome more attractive to him, with Tucker’s representatives and the league reaching an agreement on a number of games. The 2020 CBA changed the landscape regarding Personal Conduct Policy cases. Now, a third party conducts a hearing and makes findings of fact that cannot be appealed. There’s risk for both sides. Judge Sue L. Robinson (who handled the Deshaun Watson case in 2022) could find that the evidence shows wrongdoing by Tucker. She also could find that the evidence falls short of proving that he did anything. Still, if it lingers, Tucker loses. He needs to get this resolved by Week 1, if his goal is to end up with a new team as soon as possible. It’s still possible for a new team to decide to give him a shot, knowing that if/when he’s suspended, another kicker will be needed. Still, few teams will want to embrace the scrutiny that would go along with welcoming Tucker to town under the cloud of unresolved allegations involving misconduct during massage-therapy sessions. Especially since the supply of competent kickers always outweighs the demand — and since Tucker wasn’t in 2024 the kicker he used to be. DISCLAIMER: This site and the products offered are for entertainment purposes only, and there is no gambling offered on this site. This service is intended for adult audiences. No guarantees are made for any specific outcome. If you or someone you know has a gambling problem, please call 1-800-GAMBLER.",,"Published May 6, 2025 11:33 AM"
"Sports Icons Shine at the 2025 Met Gala: Angel Reese, Jalen Hurts, Simone Biles and more",The biggest names in sports took the red carpet at the 2025 Met Gala. NBC SPORTS,N/A,https://www.nbcsports.com/wnba/news/sports-icons-shine-at-the-2025-met-gala-angel-reese-jalen-hurts-simone-biles-and-more?cid=nbcnews,"Some would equate the Met Gala to “the Super Bowl of Fashion”, and this year’s red carpet (technically it was blue) didn’t disappoint as Olympic, NFL, and WNBA champions — athletes across the biggest leagues in the world — took center stage in their best looks. The theme of the 2025 Met Gala was “Superfine: Tailoring Black Style”, inspired by Monica L. Miller’s book Slaves to Fashion: Black Dandyism and the Styling of Black Diasporic Identity. Many were excited to see LeBron James, who was named the honorary chair of the 2025 Met Gala, look dapper on the carpet, but the four-time NBA Champion and MVP announced that he would be missing the historical event due to a knee injury. Still, his wife, Savannah James, dazzled in his absence. See below for a glimpse into one of fashion’s brightest nights and the standout looks of some of sports’ biggest stars, including NBC Sports’ own Maria Taylor, Super Bowl MVP Jalen Hurts, three-time Olympian Miles Chamley-Watson, and more. Getty Images for The Met Museum/Vogue The Hollywood Reporter via Getty Images Scott Gries/E! ENTERTAINMENT via Getty Images Getty Images for The Met Museum/Vogue Kevin Mazur/Getty Images for The Met Museum/Vogue RELATED: Met Gala - Simone Biles, Sha’Carri Richardson, Noah Lyles, Gabby Thomas arrival photos DISCLAIMER: This site and the products offered are for entertainment purposes only, and there is no gambling offered on this site. This service is intended for adult audiences. No guarantees are made for any specific outcome. If you or someone you know has a gambling problem, please call 1-800-GAMBLER.",,"Published May 6, 2025 11:26 AM"
"Ted Cruz: NFL has been ""tiptoeing up to the rule"" protecting college and high school football","Hearing on broadcast vs. streaming could spark new legislation, eventually. NBC SPORTS",N/A,https://www.nbcsports.com/nfl/profootballtalk/rumor-mill/news/ted-cruz-nfl-has-been-tiptoeing-up-to-the-rule-protecting-college-and-high-school-football?cid=nbcnews,"The Senate Commerce Committee has proceeded with a hearing on the pivot from sports broadcasting to streaming, without any involvement by the NFL. (Commissioner Roger Goodell declined an invitation to appear.) In his opening comments, Committee Chairman Ted Cruz (R-Tex.) made a pointed comment about the NFL. He said the league has been “tiptoeing up to” the line that protects college and high school football from being diluted by pro football. The line appears in the Sports Broadcasting Act of 1960, which gave the NFL a broadcast antitrust exemption with one key concession — the NFL cannot broadcast games from the second weekend in September through the second weekend in December on Friday night or Saturday. “One growing concern is that the NFL has used its special exemption in the SBA to the frustration of college and high school football schedulers,” Cruz said, via a transcript provided by the Committee. “For example, the SBA explicitly excludes antitrust protection for the NFL if broadcasting a game on a Friday night or a Saturday between mid-September to mid-December. That’s to protect the interests of high school and college football, and ultimately, their fans who are no doubt also followers of the NFL. “The NFL has tiptoed up to this rule, now putting a game on streaming on Black Friday afternoon, which used to be a slot reserved for prominent college football rivalries, including in some years, Texas and Texas A&M. There are millions of sports fans who like being able to follow high school, college, and professional football without having to choose amongst them. And it’s partly why Congress wrote the SBA in the manner it did.” Cruz mentioned only the Black Friday game, which starts at 3:00 p.m. ET and ideally ends before the 6:00 p.m. ET witching hour, in support of his observation. The league also has started streaming games on the first Friday of September, when the first Friday coincides with the first week of the NFL season — and clearly conflicts with high school football. There has been speculation that, with the Republican party controlling the White House and Congress, the NFL may press for revisions to the SBA that would eliminate the Friday night and/or Saturday exception. Given that a prominent Republican senator seems to be firmly in favor of enforcing the limits of the current law, Cruz likely would be against allowing the NFL to broadcast games within the current window that is regarded as off-limits. The broader question is whether streaming fits within the SBA at all. That could be a question for the courts. Or it could become a subject for further legislation. Today’s hearing seems to be a step toward considering something that would counter the exodus of live pro sports from free TV to pay TV. We’ll continue to monitor the hearing for anything related to the NFL. You can watch it here, assuming you have consumed the appropriate amount of coffee and/or Red Bull. DISCLAIMER: This site and the products offered are for entertainment purposes only, and there is no gambling offered on this site. This service is intended for adult audiences. No guarantees are made for any specific outcome. If you or someone you know has a gambling problem, please call 1-800-GAMBLER.",,"Published May 6, 2025 10:35 AM"
Billy Horschel's Ryder Cup dreams likely dashed with this announcement,Horschel revealed Tuesday that he will be sidelined until at least late summer because of right hip surgery that will take place next week in Colorado. NBC SPORTS,N/A,https://www.nbcsports.com/golf/news/billy-horschels-ryder-cup-dreams-likely-dashed-with-this-announcement?cid=nbcnews,"Billy Horschel’s Ryder Cup dreams are likely dashed – for this year at least. Horschel announced Tuesday morning that he is set to undergo right hip surgery early next week in Colorado and will be sidelined multiple months, perhaps the rest of this season. “It’s an unfortunate situation with so many great events left on the calendar, but this is a preventative measure,” Horschel said. “I’m already itching to start rehab, get back to practicing, and I look forward to returning to the course sometime around late summer/early fall.” Horschel withdrew from the Zurich Classic, where he was set to partner with Tom Hoge, citing a lower body injury. The 38-year-old Horschel had made 12 starts this season, posting two top-10s but also missing five cuts. He currently sits No. 58 in FedExCup points, No. 24 in the Official World Golf Ranking and No. 16 in U.S. Ryder Cup points. Horschel also competed in the inaugural season of TGL, where his Atlanta Drive GC won the title. Horschel’s performance, passion and energy while playing on that team prompted many to tab him for a potential Ryder Cup debut this fall at Bethpage. The matches are scheduled for Sept. 25-28, so even if Horschel returns before then, he would need to receive a captain’s pick from Keegan Bradley, and even then, he likely would not have many, if any, reps. “Every time we’re in a Ryder Cup year, I’m very well aware that I haven’t been part of a Ryder Cup team,” Horschel told Golf Channel on April 1. “But I can’t solely focus on that. I can’t have that be the driving force. At the end of the day, I’ve got to try and continue to get better as a player, continue to improve as a person, and hopefully through those gains and improvement, I can finally make a Ryder Cup team. I’ve done a lot of things in my career that I’m very grateful for and the wins I’ve had, and do I feel like I should be on a Ryder Cup team? Yeah, but have I done what I need to in terms of playing three, four, five months of consistent golf leading into the Ryder Cup? I haven’t done that, and that’s sort of been the Achilles heel a little bit; I just haven’t played as well over a period of time as the other 12 guys. “I’m in the best situation that I think I’ve ever been in my career, at this stage, six months out from a Ryder Cup. I think if I can continue to improve and continue to play well and play consistently well, hopefully it lends itself to being a part of a Ryder Cup team. “I would love to be a part of that zoo in New York. … It’s going to be the craziest Ryder Cup ever.” DISCLAIMER: This site and the products offered are for entertainment purposes only, and there is no gambling offered on this site. This service is intended for adult audiences. No guarantees are made for any specific outcome. If you or someone you know has a gambling problem, please call 1-800-GAMBLER.",,"Published May 6, 2025 10:17 AM"
Nylander has 2 goals and an assist as Maple Leafs beat Panthers 5-4 in Game 1 of 2nd round series,"Matthew Knies and Chris Tanev each had a goal and an assist, and Morgan Rielly also scored for the Maple Leafs. NBC SPORTS",N/A,https://www.nbcsports.com/nhl/news/nylander-has-2-goals-and-an-assist-as-maple-leafs-beat-panthers-5-4-in-game-1-of-2nd-round-series?cid=nbcnews,"John E. Sokolowski-Imagn Images TORONTO (AP) William Nylander got the Toronto Maple Leafs off to a fast start in the second round of the Stanley Cup playoffs. Nylander scored twice in the first period before adding an assist as Toronto built a big lead before holding on to beat the Florida Panthers 5-4 on Monday night in the series opener. Matthew Knies and Chris Tanev each had a goal and an assist, and Morgan Rielly also scored for the Maple Leafs. Max Pacioretty and Jake McCabe each had two assists. “We’ve been in tight games throughout the season,” Nylander said. “We dug into that and tried to bear down.” Anthony Stolars stopped eight of the nine shots he faced before leaving in the second period after he took an elbow to the head from Panthers forward Sam Bennett, who wasn’t penalized on the play. The Maple Leafs said the 31-year-old was being evaluated, but provided no further update. “Elbow to the head,” Toronto coach Craig Berube said. “Clear as day. ... I get it, they miss calls. But it’s clearly a penalty.” Joseph Woll stopped 17 shots in relief. Seth Jones, Eetu Luostarinen, Uvis Balinskis and Sam Bennett scored for the Panthers, and Brad Marchand and Carter Verhaeghe each had two assists. Sergei Bobrovsky stopped 24 shots. Florida beat Toronto in five games in the second round in the 2023 playoffs on the way to reaching the Stanley Cup Final. The Panthers went one step further last year when they won the Cup for the first time in franchise history. Game 2 is Wednesday back at Scotiabank Arena, before shifting to South Florida for two games. Toronto opened the scoring just 33 seconds after puck drop when Nylander beat Bobrovsky through the five-hole from a tight angle for his fourth goal of the playoffs. The Maple Leafs, who beat Ottawa in six games in the first round to register just the second series win for the Original Six franchise in more than two decades, went up 2-0 with 7:09 left in the first when Nylander scooped up a rebound before deking Bobrovsky to the ice and roofing his second of the period. “He came out and was feeling it,” Rielly said of the slick winger. “That helps set the tone.” Jones got the Panthers on the board with a shot from the point through traffic on a power play with 3:03 remaining for his second of the postseason. Toronto restored its two-goal lead just 19 seconds later when Nylander sent Rielly off to the races on a 2-on-1 with John Tavares. The defenseman and longest serving member of the current roster looked Bobrovsky off before firing past the goalie’s blocker for his third of the postseason. “Obviously it wasn’t a great start by us,” Panthers forward Aleksander Barkov said. “We knew they were going to come hard and strong.” Florida, which beat the Tampa Bay Lightning in five games to advance, got a man advantage in the second that saw Stolarz make a couple of stops, but Bennett caught him with a sneaky elbow to the back of the head. Toronto made it 4-1 at 7:50 when Tanev’s knuckling shot from distance fooled Bobrovsky for his first. Stolarz, who backed up Bobrovsky on the way to Florida’s Cup win a year ago, was seen on television vomiting by the bench a few minutes later before getting replaced by Woll. Nylander had a chance to complete the first playoff hat trick of his career on a shot that knocked the stick out of Bobrovsky’s hand but the puck stayed out as the Maple Leafs headed to the locker room up three. Luostarinen cut the deficit back to two on a redirection 1:41 into the third, and Balinskis then made it 4-3 at 4:30 after a Panthers push inside a suddenly tense building. “We didn’t look like ourselves,” Florida head coach Paul Maurice said of his team’s opening period. “And then (we) righted it in the second and after that had a pretty good push in the third.” Toronto failed to connect on two power plays later in third before Bobrovsky denied Max Domi on a break. Knies made it 5-3 with 6 minutes left in regulation with a move to the backhand on another breakaway. Bennett got his team back within one with 1:55 left in regulation on a pinballed shot off a Toronto stick, but Woll and the Maple Leafs held the fort late to secure an early lead in the series. “That was nice for us,” Nylander said. “But we’re just focused on next game now.” The Panthers were without defenseman Aaron Ekblad, who finished off a two-game suspension for his headshot on Tampa Bay forward Brandon Hagel in the opening round. The Maple Leafs have three players from the Panthers’ championship team - Stolarz, defenseman Oliver Ekman-Larsson and Steven Lorentz. AP NHL playoffs: https://apnews.com/hub/stanley-cup and https://apnews.com/hub/nhl DISCLAIMER: This site and the products offered are for entertainment purposes only, and there is no gambling offered on this site. This service is intended for adult audiences. No guarantees are made for any specific outcome. If you or someone you know has a gambling problem, please call 1-800-GAMBLER.",,"Published May 5, 2025 11:51 PM"
NASCAR Championship Weekend moving to Homestead in 2026,NASCAR will begin rotating sites for the championship race in 2026. NBC SPORTS,N/A,https://www.nbcsports.com/nascar/news/nascar-championship-weekend-moving-to-homestead-in-2026?cid=nbcnews,"NASCAR’s Championship Weekend will return to Homestead-Miami Speedway in 2026, the sanctioning body announced Tuesday morning. NASCAR also announced that it will rotate its season finale for the Cup, Xfinity and Craftsman Truck Series starting next year among “NASCAR’s marquee venues and key markets.” NBC Sports, which has broadcast the Cup playoffs and championship race since 2015, will do so through 2031. Phoenix, which has hosted NASCAR’s Championship Weekend since 2020, will be among the rotating sites for the season-ending race for each series. NASCAR also announced that Phoenix will host two Cup weekends next year and that the track’s second race weekend will be in the third round of the playoffs. Those dates will be announced later. Homestead-Miami Speedway’s Championship Weekend will be Nov. 6-8 in 2026. Homestead hosted the championship races for Cup, Xfinity and Trucks from 2002-19 before the season finale moved to Phoenix. “Homestead-Miami Speedway has a history of competitive, championship racing that will provide nostalgia for veteran drivers and fans and exhilaration for NASCAR’s new generation,” said Ben Kennedy, EVP, Chief Venue & Racing Innovation Officer, in a statement. “As we move forward, the rotating model will provide new challenges for competitors as well as opportunities for unique venues to host our loyal fans at NASCAR Championship Weekend.” Kyle Larson won the most recent Cup race at Homestead, taking the checkered flag in March in a race that had 27 lead changes. Last fall’s playoff race at Homestead saw Tyler Reddick win after going from third to first on the last lap. The last three laps each had a different leader in that event. “This place is awesome,” said Christopher Bell, who finished fourth in that race and watched those lead changes ahead of him. “It leads to some amazing races.” He’s not the only driver who feels that way. “It’s just an awesome race track,” Larson said of Homestead this season. “Definitely the best across all the series in our sport. It’s just fun. It races kind of similar in all the divisions. It’s just a cool place.” DISCLAIMER: This site and the products offered are for entertainment purposes only, and there is no gambling offered on this site. This service is intended for adult audiences. No guarantees are made for any specific outcome. If you or someone you know has a gambling problem, please call 1-800-GAMBLER.",,"Published May 6, 2025 10:00 AM"
A key ruling in Jon Gruden's pending lawsuit could come at any time,"In Monday's item about former Raiders, Buccaneers, and Raiders coach Jon Gruden joining the AF1's Nashville Kats as a part owner and adviser, we mentioned his pending lawsuit against the NFL and Commissioner Roger Goodell. NBC SPORTS",N/A,https://www.nbcsports.com/nfl/profootballtalk/rumor-mill/news/a-key-ruling-in-jon-grudens-pending-lawsuit-could-come-at-any-time?cid=nbcnews,"In Monday’s item about former Raiders, Buccaneers, and Raiders coach Jon Gruden joining the AF1’s Nashville Kats as a part owner and adviser, we mentioned his pending lawsuit against the NFL and Commissioner Roger Goodell. There’s been no news about the case in months, so we checked on its status. The litigation is still pending before the Nevada Supreme Court on a rehearing before the full court as to the question of whether the case will proceed in court, or whether it will be sent to the NFL’s in-house arbitration system, also known in some places (here) as a secret, rigged, kangaroo court. A ruling. we’re told, could come at any time. The last order was issued on October 10, 2024, with the Nevada Supreme Court granting the request for “en banc” reconsideration — and explaining that the decision would be made based on the existing briefs and official record. Gruden won at the trial court level on the question of whether the case should remain in the Nevada court system. The NFL prevailed before a three-judge panel of the Nevada Supreme Court. At least two judges of the full court agreed to conduct a rehearing before all seven judges. Gruden lost, 2-1, before the three judges who considered the case the first time around. Now, with seven judges on the full court, Gruden will need at least four to agree with his position that the NFL should not be permitted to seize on a very aggressive interpretation of the league’s Constitution and Bylaws to pull the dispute into arbitration. Beyond the question of whether the NFL Constitution and Bylaws justify mandatory arbitration of Gruden’s case is the broader issue regarding whether the Commissioner should have ultimate authority over legal claims made against the NFL generally and/or the Commissioner specifically. However it plays out, the issue seems to be destined for the U.S. Supreme Court. Which currently has more than enough pro-business judges to deliver a win for the NFL. Even if Gruden shares the same general political views that could eventually torpedo his case. DISCLAIMER: This site and the products offered are for entertainment purposes only, and there is no gambling offered on this site. This service is intended for adult audiences. No guarantees are made for any specific outcome. If you or someone you know has a gambling problem, please call 1-800-GAMBLER.",,"Published May 6, 2025 10:09 AM"
