headline,description,timestamp,article_link,article_content,writer,date_published
"Minnesota Timberwolves vs. Golden State Warriors Preview: 2025 NBA Playoffs series prediction, schedule",This is only the third ever meeting of the No. 6 and No. 7 seeds in the playoffs. NBC SPORTS,N/A,https://www.nbcsports.com/nba/news/minnesota-timberwolves-vs-golden-state-warriors-preview-2025-nba-playoffs-series-prediction-schedule?cid=nbcnews,"This is only the third time in NBA history that the No. 6 and No. 7 seeds meet in the playoffs. However, the last time was two years ago and also included the Warriors (vs. Lakers, a series won by Los Angeles, who was then swept in the conference finals by eventual champion Denver). Here is what to know from this series. Minnesota travels to Golden State for the series opener on Tuesday night, May 6, at 9:30 p.m. Eastern. This is a fast turnaround for the Warriors, who played in a Game 7 in Houston on Sunday. All times are Eastern (* = if necessary) Game 1: Warriors at Timberwolves (Tue. May 6, 9:30 ET, TNT) Game 2: Warriors at Timberwolves (Thu. May 8, 8:30 ET, TNT) Game 3: Timberwolves at Warriors (Sat. May 10, 8:30 ET, ABC) Game 4: Timberwolves at Warriors (Mon. May 12, 10 ET, ESPN) Game 5: Warriors at Timberwolves (Wed. May 14, TBD, TNT)* Game 6: Timberwolves at Warriors (Sun. May 18, TBD, TBD)* Game 7: Warriors at Timberwolves (Tue. May 20, 8:30 ET, ESPN)* Nobody guarded Stephen Curry more in the regular season than Jaden McDaniels. Per NBA.com, McDaniels spent 28:40 matched up with Curry across four regular season matchups. The next closest was Keegan Murray at 18:50. Curry averaged 28.8 points per game against Minnesota in the regular season, and the Warriors went 3-1 in their matchups. The last time these teams played was in January, and Golden State’s lineup looks quite different. That shouldn’t change things for McDaniels, who averaged four fouls per game in the first round. They need him on the floor and making life difficult for Curry. McDaniels enjoyed the best statistical season of his career this year, and that translated into 17.4 points per game in the first round. The Warriors’ defense will be keyed in on slowing down Anthony Edwards and Julius Randle, and McDaniels will need to step up as a scorer. He only averaged 10.8 points per game against the Warriors in the regular season. This series is a big opportunity for him on both ends of the floor. —Noah Rubin, Rotoworld basketball analyst Golden State’s most-used lineup — and arguably best — in the first round was a small-ball five with Stephen Curry, Brandin Podziemski, Buddy Hield, Jimmy Butler III and Draymond Green at center (it had a +13.9 net rating). That lineup will struggle to defend a huge Minnesota starting five of Mike Conley, Anthony Edwards, Jaden McDaniels, Julius Randle and Rudy Gobert. It’s an issue of size. Steve Kerr can start Butler on Ant and Green on Randle to try and slow the two Minnesota shot creators (or swap the Butler/Green assignments), but there are potential mismatches elsewhere, such as who guards Gobert? The French big man punished the Lakers in the last series when they went small (particularly in the closeout game). Kerr could play a lot of Kevon Looney to match up with Gobert, but that still leaves a smaller player on McDaniels while at the same time hurting the Warriors’ offense. Gary Payton II could get heavy minutes this season because of his defense. Golden State’s ultimate concern is this: A big Minnesota team plays nearly as good of defense as Houston, but led by Edwards, the Timberwolves’ offense is exponentially better. Especially if Randle plays at the level he did against the Lakers. There’s more than a little history here. In a playoffs where the referees have permitted — if not outright green lit — increased physicality, letting Green and Gobert go at it with the proverbial gloves off could impact the series. Another thing to watch with Green and Gobert: Will one have a big offensive impact in a game or games? When they did (Gobert in Game 5 vs. the Lakers, Green early in Game 7 vs. the Rockets), it’s a huge boost for their team. —Kurt Helin, NBC Sports lead NBA writer Minnesota is a version of Houston that can actually score. The Wolves will give GSW a lot of the same issues the Rockets did - size, athleticism, speed - but instead of Jalen Green as chief protagonist on offense it’ll be Anthony Edwards. This Minnesota team looks improved on last year’s version that entered the conference finals as heavy favorite - they’re more versatile now and can play more styles. Their ability to play super big, or go 5 out with elite spacing and switching, should be too much for Golden State. Golden State has the best offensive player in the series with Steph and the experience with vet players and coach, but the numbers look bad in terms of overall matchup here, and the Warriors are coming out of a truly physical seven-game series that may have taken the wind out of their sails. Minnesota has had a propensity for playing with their food so I’m prepared to be wrong and would love a better price for them in series than what is currently available but it’s looking like a clean win for Minnesota to me. Before the playoffs tipped off, I predicted Golden State would advance to the Western Conference Finals, but after seeing Minnesota in person in the first round and watching the Warriors vs. Rockets games, I changed my mind. Anthony Edwards is ready for his star turn and will be the best player in this series (sorry, Steph), the Timberwolves’ defense will challenge the Warriors as much or more than Houston, and Minnesota brings size across the board that Golden State will struggle to handle. The Warriors with Butler will not go quietly, but this is a rough matchup for them, if they thought the Rockets were physical… DISCLAIMER: This site and the products offered are for entertainment purposes only, and there is no gambling offered on this site. This service is intended for adult audiences. No guarantees are made for any specific outcome. If you or someone you know has a gambling problem, please call 1-800-GAMBLER.",,"Published May 6, 2025 08:08 AM"
Knicks vs. Celtics Game 1: New York steals (Mikal Bridges literally) Game 1 from Boston in overtime thriller,Celtics set a playoff record with 45 missed 3-pointers in a game where they launched 60. NBC SPORTS,N/A,https://www.nbcsports.com/nba/news/new-york-steals-mikal-bridges-literally-game-1-from-boston-in-overtime-thriller?cid=nbcnews,"Celtics coach Joe Mazzulla, were you happy with your team’s shot selection in Game 1? “For the most part,” he answered. That explains a lot of this game. Boston followed Mazzulla’s blueprint and launched 60 3-pointers in Game 1 of their Eastern Conference Semi-Final matchup with New York, missing 45 (an NBA playoff record) and hitting just 15, or 25%. Boston shooters missed a lot of open ones, but they also took a lot of difficult, contested ones, as well as tough shots in the paint. “Some of them felt good, some of them felt like we maybe forced the issue,” Jaylen Brown said. “Definitely our rhythm and our timing was a little bit off. We got a lot of great looks, but there may be some truth to that. We’ve got to look at the film and see what happened in that second half.” The Celtics had success early with matchup hunting — Jayson Tatum going after Karl-Anthony Towns, getting the big man in foul trouble — and led by as many as 20 in the third quarter. Then Boston’s shooting dried up. The Knicks were the definition of resilient — they could have rolled over down 20 but didn’t. With a 20-6 run in the second half of the third quarter, New York stormed back to make it a game. Jalen Brunson was doing his own matchup hunting, going at Al Horford, and it worked. The game went to overtime, and Mikal Bridges’ defense sealed it more than anything. The result was a 108-105 New York win that has the Knicks up 1-0 on the road and left Celtics faithful stunned and confused. Boston, as it had at points during the regular season, stuck with what wasn’t working and didn’t shift enough to getting buckets in the paint, or even good looks from the midrange (the Celtics were 6-of-15 on shots from four feet out to the arc). The result was opening the door for New York, but Boston saw this more as just missed shots. “Probably some times where we settled,” said Jayson Tatum, who finished with 29 points but was 0-of-7 shooting in the fourth quarter. “I could’ve put more pressure on the rim. But a lot of times, we felt like we got really, really good looks and just couldn’t convert.” Meanwhile, Jalen Brunson just kept making plays on his way to 29 points, and OG Anunoby matched him bucket for bucket. While the Celtics were missing, the Knicks hit 17 3-pointers, shooting 45.9% from beyond the arc. In last year’s playoffs, an injury or just an off night for Boston didn’t automatically mean a loss, as it cruised to the title. That is not going to be the case this season. If the Celtics want to repeat, they must play closer to their peak. They did not on Monday night and now find themselves in a hole against a resiliant Knicks team that is playing with great confidence and believes it can win this series. DISCLAIMER: This site and the products offered are for entertainment purposes only, and there is no gambling offered on this site. This service is intended for adult audiences. No guarantees are made for any specific outcome. If you or someone you know has a gambling problem, please call 1-800-GAMBLER.",,"Published May 6, 2025 01:01 AM"
"New York Islanders win the NHL draft lottery, securing the No. 1 selection. Sharks will pick second","The New York Islanders, who missed the playoffs for the second time in four seasons, earned a remarkable lottery win by entering the day with a 3.5% shot — the 10th-best odds — of seeing their numbers come up. NBC SPORTS",N/A,https://www.nbcsports.com/nhl/news/new-york-islanders-win-the-nhl-draft-lottery-securing-the-no-1-selection-sharks-will-pick-second?cid=nbcnews,"New York Islanders pro scouting director Ken Morrow knows a thing or two about so-called hockey miracles. Witnessing the Islanders win the NHL draft lottery on Monday and vault nine other teams in the order for the right to have the No. 1 pick represented yet another memorable moment for the four-time Stanley Cup champion and member of the 1980 gold-medal-winning “Miracle on Ice” U.S. Olympic team. “I’ve had a lot of thrills in my hockey life, but this is right up there at the top,” Morrow said. “The hockey gods smiled on us. I can’t tell you how thrilled I am for Islanders fans, for our ownership, for the entire Islanders organization.” The Islanders, who missed the playoffs for the second time in four seasons, are in the midst of a front-office shakeup after not renewing general manager Lou Lamoriello’s contract on April 22. And they earned a remarkable lottery win by entering the day with a 3.5% shot — the 10th-best odds — of seeing their numbers come up. New York wasn’t the only team to buck the lottery odds. The Utah Hockey Club won the second round of the lottery, and made the jump from 14th to fourth under the rules limiting teams from moving up no more than 10 spots in the draft order. “A couple of seconds ago, we were just like 10 back, so it still hasn’t sunk in,” Utah GM Bill Armstrong said of a first-year franchise that finished just seven points out of a playoff spot. “This is an exciting moment for us. It’s a game-changer for us.” The San Jose Sharks will pick second after entering the day with the best odds, 18.5%, to win the lottery and a 25.5% chance of landing the No. 1 choice. San Jose, which finished last for a second consecutive year, was seeking to become the NHL’s first team to win the lottery and pick first in consecutive years. “We definitely lucked it out last year to be able to select Mac,” Sharks GM Mike Grier said in referring to selecting Boston University center Macklin Celebrini first overall. “This year would have obviously been nice to have the pick and have the choice of all the players. But picking two, we’re still in a pretty good spot so we’re happy.” The Chicago Blackhawks had the second-best chances to win the lottery and will pick third. The remaining 12 teams moved two spots back in the order, starting with Nashville dropping from third to fifth. The final 16 draft spots will be determined following the playoffs. The Islanders have the right to pick first for the fifth time in team history, and first since selecting John Tavares with the No. 1 choice in 2009. This year’s draft will be held in Los Angeles with the first round taking place on June 27, followed by the final six rounds the next day. Top prospects will convene for the weeklong predraft combine being held in Buffalo next month. The prospect pool is not considered as deep at the top as last year’s class, or next year’s group, with Canadian junior forward Gavin McKenna long regarded as the No. 1 candidate. Erie Otters defenseman Matthew Schaefer is NHL Central Scouting’s top-ranked North American prospect followed by OHL Saginaw center Michael Misa and Boston College center James Hagens, the top-ranked U.S. born prospect. Hagens is from Long Island and grew up an Islanders fan. Listed at 6-foot-2 and 183 pounds, Schaefer maintained his No. 1 position despite missing the final three months of the season after breaking his right collarbone representing Canada at the world junior championships in December. Schaefer has the potential of becoming only the fifth defenseman selected No. 1 since 2000, and first since Buffalo chose Owen Power in 2021. And he also has the chance of being the first OHL player to go No. 1 since Edmonton drafted Erie’s Connor McDavid in 2015. The top-ranked international skaters are center Anton Frondell and right wing Victor Eklund, who are teammates with Djurgarden of Sweden’s second division league. New York’s jump from 10th to first is the biggest involving a team winning the No. 1 selection. And it comes after the last-place team won the lottery to retain the first pick in four of the past five years and 12 times overall since the NHL launched the format in 1995. The New York Rangers enjoyed the previous largest move up to No. 1 in 2020, when they were grouped among eight teams — ranked eighth to 15th — with the same odds to win the lottery after being eliminated in the COVID-altered play-in round of the expanded 24-team playoff format. The lottery was held at the NHL Network studios in New Jersey, and conducted live for the first time in the event’s 30-year history. Previously, the lottery was held shortly before the broadcast in front of a limited audience of sequestered observers, followed by the draft selections being revealed in reverse order. DISCLAIMER: This site and the products offered are for entertainment purposes only, and there is no gambling offered on this site. This service is intended for adult audiences. No guarantees are made for any specific outcome. If you or someone you know has a gambling problem, please call 1-800-GAMBLER.",,"Published May 6, 2025 09:27 AM"
Nuggets vs. Thunder Game 1: Aaron Gordon 3-pointer caps Denver comeback to steal Game 1 in Oklahoma City,Nikola Jokic was the best player on the floor with 42 points and 22 rebounds. NBC SPORTS,N/A,https://www.nbcsports.com/nba/news/aaron-gordon-3-pointer-caps-19-6-denver-run-to-come-from-behind-steal-game-1-in-oklahoma-city-121-119?cid=nbcnews,"In a span of less than five minutes Monday night, the “Oklahoma City isn’t ready for this” crowd got all the ammunition it needed. The Thunder led most of the night by double-digits, by 13 at one point in the fourth quarter and by 11 with 4:31 left after a Shai Gilgeous-Alexander 3-pointer. All OKC needed was its league-best defense to do its job and it would have another home playoff win. Then Denver went on a 19-6 run to close the game, capped off by another Aaron Gordon clutch moment, this one a game-winning 3-pointer. That combined with a 42-point, 22-rebound night from Nikola Jokic earned a resilient Denver Nuggets team a 121-119 road win and a 1-0 lead in this Western Conference Semi-Final series. Game 2 is Wednesday night in Oklahoma City. This is a heartbreaking loss for the Thunder, who were up by double-digits most of the night but could not close it out. “We’re gonna find out what we’re made of,” Gilgeous-Alexander said after the loss. He finished the night with 33 points on 12-of-26 shooting. If Oklahoma City wants to know why it lost, or if Denver wants to know why it won, there are two key things (in addition to Jokic being the best player on the court): 1) Offensive rebounds. Denver had 21 of them, leading to 27 second-chance points. Gordon had seven of those rebounds. 2) Missed free throws. Oklahoma City was 20-of-28 from the line, and no two misses were as critical as Chet Holmgren’s two with 9.5 seconds left in the game and the Thunder up one. Holmgren’s teammates rightly pointed out this game was not lost in the last 15 seconds; this was a night of mistakes by the Thunder that left the door open just enough for Aaron Gordon to come barging through and get the win. Gordon finished with 22 points and 14 rebounds for Denver, while Jamal Murray added 21 points and six assists. For the Thunder, after SGA’s 33, there was 20 off the bench from Alex Caruso, who also had five steals and played a fantastic game. Jalen Williams has to be better, 16 points on 5-of-20 shooting is not good enough. DISCLAIMER: This site and the products offered are for entertainment purposes only, and there is no gambling offered on this site. This service is intended for adult audiences. No guarantees are made for any specific outcome. If you or someone you know has a gambling problem, please call 1-800-GAMBLER.",,"Published May 6, 2025 02:58 AM"
"Michael Strahan, Eli Manning prepare competing bids for Giants' minority stake",Two former teammates will soon be competing for a piece of their team. NBC SPORTS,N/A,https://www.nbcsports.com/nfl/profootballtalk/rumor-mill/news/michael-strahan-eli-manning-prepare-competing-bids-for-giants-minority-stake?cid=nbcnews,"Two former teammates will now be competing to buy a piece of the team for which they played. Sportico reports that Hall of Fame defensive end Michael Strahan plans to make a bid for the 10-percent stake that the Giants are looking to sell. Strahan will partner with billionaire Marc Lasry in the effort to come up with the $750 million (or more) needed to buy one tenth of the team. Former Giants quarterback Eli Manning, who inevitably will join Strahan in Canton, has a separate bid in the works. He reportedly had “preliminary conversations” about joining Strahan’s group, but Eli ultimately decided to go it alone. The Strahan-Lasry combo is the latest example of the newest dynamic when it comes to minority NFL ownership, sparked by the ever-skyrocket value of teams. A rich guy with significant name recognition in league circles combines with a really rich guy with no existing pro football footprint to come up with the cash necessary to do the deal. Presumably, the Giants are looking for market value for the interest they’re selling. Raiders owner Mark Davis opted to give Tom Brady a steep discount for the value of his involvement in football operations. Most owners won’t leave that many millions on the table, when they can hire proven football executives for far, far less than that. Especially not for a player who never played for the team. In New York, where both Strahan and Manning have their numbers retired (unless and until the Giants draft a player who asks to wear it), the Giants likely won’t be retiring the age-old habit of seeking the best deal possible for what they are selling. DISCLAIMER: This site and the products offered are for entertainment purposes only, and there is no gambling offered on this site. This service is intended for adult audiences. No guarantees are made for any specific outcome. If you or someone you know has a gambling problem, please call 1-800-GAMBLER.",,"Published May 6, 2025 09:22 AM"
"Jalen Milroe working to become a more ""efficient passer"" ahead of rookie season","Jalen Milroe was a successful quarterback at Alabama, but his ability to make plays with his feet led to discussion heading into the draft about whether he'd be used in other ways as an NFL player. NBC SPORTS",N/A,https://www.nbcsports.com/nfl/profootballtalk/rumor-mill/news/jalen-milroe-working-to-become-a-more-efficient-passer-ahead-of-rookie-season?cid=nbcnews,"Jalen Milroe was a successful quarterback at Alabama, but his ability to make plays with his feet led to discussion heading into the draft about whether he’d be used in other ways as an NFL player. Milroe was adamant that he’s only a quarterback and Seahawks head coach Mike Macdonald said the same thing after Seattle took Milroe in the third round last month. That may settle one question, but it doesn’t guarantee that Milroe is going to get a chance to show that he can handle the starting job. The rookie has been working with quarterback coach Jordan Palmer to help his bid and Milroe explained some of what he’s been doing during the team’s rookie minicamp. “The biggest thing is everything works from the ground up at the quarterback position,” Milroe said, via Seattle Sports. “It’s understanding the lower-half mechanics of how I operate. Every quarterback is different, and so . . . it’s understanding how to distribute my body when it comes to the lower-half mechanics. That’s been a focus for us. It’s all about being an efficient passer. And so the more you work, the more you understand your body, you’re going to be more of an efficient passer. So that’s something that we continue to work on.” With Sam Darnold and Drew Lock on the roster in Seattle, practice reps are going to be limited for Milroe so his extracurricular work will be all the more significant as he tries to work his way onto the field. DISCLAIMER: This site and the products offered are for entertainment purposes only, and there is no gambling offered on this site. This service is intended for adult audiences. No guarantees are made for any specific outcome. If you or someone you know has a gambling problem, please call 1-800-GAMBLER.",,"Published May 6, 2025 06:39 AM"
"Barry Sanders thinks Jahmyr Gibbs, David Montgomery can lead the Lions to a Super Bowl",Saquon Barkley's big season with the Eagles has led to renewed talk that NFL teams can ride a running back to the Super Bowl. NBC SPORTS,N/A,https://www.nbcsports.com/nfl/profootballtalk/rumor-mill/news/barry-sanders-thinks-jahmyr-gibbs-david-montgomery-can-lead-the-lions-to-a-super-bowl?cid=nbcnews,"Saquon Barkley’s big season with the Eagles has led to renewed talk that NFL teams can ride a running back to the Super Bowl. Or in the case of the Lions, perhaps ride two running backs to the Super Bowl. Barry Sanders, who won only one playoff game during his Hall of Fame career with the Lions, told USA Today that he thinks the combination of Jahmyr Gibbs and David Montgomery can give the Lions a championship offense, revolving around its running game. “They’re the best duo in the NFL and there’s no reason that’s going to change any time soon,” Sanders said. “If a Super Bowl is in our future, in our near future, you would think those two guys would be a big part of it.” Sanders said he’s been a fan of Montgomery’s since before the Lions signed him, and that Gibbs showed when Montgomery missed time with a knee injury last season that he’s also more than capable of being a No. 1 running back. “David Montgomery, he’s been a great running back in the NFL for many years, and he just added to that coming over from the Bears and putting him with this Lions offensive line,” Sanders said. “And then, you see what Jahmyr Gibbs was able to do last season, really from the time, the last two years that he’s been here, but I felt like last year was more of a breakout season for him.” It was the Lions’ best regular season in almost 70 years, but it fizzled in the playoffs. If the Lions are ever going to get over the hump in the postseason, Sanders thinks it will be on the back of their running game. DISCLAIMER: This site and the products offered are for entertainment purposes only, and there is no gambling offered on this site. This service is intended for adult audiences. No guarantees are made for any specific outcome. If you or someone you know has a gambling problem, please call 1-800-GAMBLER.",,"Published May 6, 2025 04:21 AM"
